{
  "version": 2,
  "eventType": "SyncTrigger",
  "region": "us-east-1",
  "identityPoolId": "identityPoolId",
  "identityId": "identityId",
  "datasetName": "datasetName",
  "datasetRecords": {
    "sampleKey1": {
      "oldValue": "oldValue1",
      "newValue": "newValue1",
      "op": "replace"
    },
    "sampleKey2": {
      "oldValue": "oldValue2",
      "newValue": "newValue2",
      "op": "replace"
    }
  }
}